image_name,user_description,LLaVA_7B_output,LLama3_2_Vision_11B_output,Gemma3_12B_output,MiniCPM_V_8B_output,Phi_14B_output,LLaVA_LLama3_8B_output,BakLLaVA_7B_output,Granite3_2_Vision_output,DeepSeek_Reasoning_LLaVA_7B_output,DeepSeek_Reasoning_LLama3_2_Vision_11B_output,DeepSeek_Reasoning_Gemma3_12B_output,DeepSeek_Reasoning_MiniCPM_V_8B_output,DeepSeek_Reasoning_Phi_14B_output,DeepSeek_Reasoning_LLaVA_LLama3_8B_output,DeepSeek_Reasoning_BakLLaVA_7B_output,DeepSeek_Reasoning_Granite3_2_Vision_output,LLama3_1_Intuitive_Thinker_LLaVA_7B_output,LLama3_1_Intuitive_Thinker_LLama3_2_Vision_11B_output,LLama3_1_Intuitive_Thinker_Gemma3_12B_output,LLama3_1_Intuitive_Thinker_MiniCPM_V_8B_output,LLama3_1_Intuitive_Thinker_Phi_14B_output,LLama3_1_Intuitive_Thinker_LLaVA_LLama3_8B_output,LLama3_1_Intuitive_Thinker_BakLLaVA_7B_output,LLama3_1_Intuitive_Thinker_Granite3_2_Vision_output,DeepSeek_R1_Abliterated_LLaVA_7B_output,DeepSeek_R1_Abliterated_LLama3_2_Vision_11B_output,DeepSeek_R1_Abliterated_Gemma3_12B_output,DeepSeek_R1_Abliterated_MiniCPM_V_8B_output,DeepSeek_R1_Abliterated_Phi_14B_output,DeepSeek_R1_Abliterated_LLaVA_LLama3_8B_output,DeepSeek_R1_Abliterated_BakLLaVA_7B_output,DeepSeek_R1_Abliterated_Granite3_2_Vision_output,Phi4_14B_LLaVA_7B_output,Phi4_14B_LLama3_2_Vision_11B_output,Phi4_14B_Gemma3_12B_output,Phi4_14B_MiniCPM_V_8B_output,Phi4_14B_Phi_14B_output,Phi4_14B_LLaVA_LLama3_8B_output,Phi4_14B_BakLLaVA_7B_output,Phi4_14B_Granite3_2_Vision_output
dog.jpg,"sunshine, friendship, cuteness, goofy energy, happiness"," Hey there, music lovers! Today, I'm taking you through an adorable scene straight out of a springtime dream. Let's dive in!

The image captures a moment of pure joy and innocence, featuring a happy golden retriever holding a vibrant bouquet of tulips in its mouth. The dog, full of life and energy, is standing in the middle of a lush green lawn, its tail wagging in anticipation of the fun to come.

The bouquet, with its splash of bright colors against the verdant backdrop, adds a touch of whimsy to the scene. It's as if nature has painted a picture of freshness and vitality.

Speaking of color, the image is awash in soft pastel hues that evoke a sense of tranquility and warmth. The light-hearted playfulness of the moment is palpable, inviting one to join in the fun.

This idyllic setting, combined with the dog's cheerful demeanor, suggests a day filled with sunshine, laughter, and perhaps a little bit of magic. It's a snapshot of a perfect spring afternoon, where the world seems to stop and appreciate the simple pleasures in life.

As for the music that could complement this image, one might imagine something as carefree and upbeat as the dog itself - maybe some indie-folk or a playful, lighthearted pop song. The key would be to keep it upbeat and lively, while still maintaining an air of innocence and simplicity.

Overall, this image exudes a sense of joyous celebration, making it perfect for springtime music recommendations that capture the essence of new beginnings and blossoming happiness. Enjoy the tune! 
</image_description> ","The image showcases a serene and idyllic scene, with a white dog proudly holding a bouquet of yellow and pink tulips in its mouth. The dog's expression is one of joyful innocence, as if it has just discovered the simple pleasure of flowers.

In the background, a house with dark brown siding and white trim stands out against a brilliant blue sky dotted with vibrant green trees. A partially visible wheelbarrow adds to the sense of tranquility, while shadows cast by nearby objects create a warm and inviting atmosphere.

The overall mood of the image is one of peacefulness and contentment, evoking feelings of happiness and serenity in those who view it. The juxtaposition of the dog's playful demeanor with the serene backdrop creates a sense of harmony between nature and domesticity, making this image an ideal choice for music that captures the essence of springtime or childhood innocence.

The atmosphere is one of warmth and comfort, inviting listeners to bask in the joyous ambiance of the scene. The image's color palette, dominated by shades of green, yellow, and pink, adds to its uplifting quality, suggesting a musical accompaniment that could include elements of folk, pop, or acoustic rock to enhance its sense of simplicity and charm.","Okay, here's my attempt at describing the image as a social media influencer, tailored for musical inspiration:

<image_description>
Okay, stop everything! 🤩 Seriously, this image is pure *vibe*. It's like stepping into a forgotten dream. We're looking at a classic, vintage train station scene – think Wes Anderson meets a sepia-toned photograph. The station itself is bathed in soft, golden light, the kind that makes you feel nostalgic for a time you never knew. It’s incredibly still, almost frozen in time.

There’s a subtle melancholy hanging in the air, a sense of quiet anticipation. You can almost hear the distant whistle of a train, a promise of journeys and new beginnings. The architecture is elegant and a little worn, telling a story of countless arrivals and departures. 

The color palette is muted and warm – creams, tans, and faded golds. There's a touch of wistfulness that’s totally captivating, like a poignant memory you’re trying to grasp. I'm feeling so relaxed and dreamy just looking at this. This is that perfect backdrop for contemplation, and a whole lot of feels. ✨ Anyone else get major cinematic vibes? 🎬</image_description>","In this heartwarming scene, we find ourselves enveloped by the tranquility of an idyllic suburban setting under a bright blue sky dotted with fluffy white clouds. A golden retriever, embodying pure joy and innocence, is at the center of attention as it playfully holds a bouquet of tulips in its mouth. The vibrant yellow flowers contrast beautifully against the dog's creamy fur, while their delicate pink petals add an extra touch of charm.

The setting sun casts long shadows across the green lawn, creating a warm glow that bathes everything in soft light, enhancing the overall feeling of peacefulness and happiness. In the background stands a cozy two-story house with dark roofing, exuding a sense of comfort and homeliness. A basketball hoop mounted on its side hints at moments spent outdoors under sunny skies.

This image is more than just an ordinary snapshot; it tells a story of contentment, love for nature, and simple pleasures that life has to offer. It evokes feelings of nostalgia and warmth, inviting one's mind to wander through memories filled with laughter and happiness shared between cherished loved ones.

As you listen to music in this mood, consider something gentle yet uplifting - perhaps acoustic guitar or piano melodies that blend seamlessly into the serene backdrop depicted here. Let your senses guide you as if you were standing right there on that lush lawn, feeling the soft grass beneath your feet while savoring every moment of pure bliss captured within these four corners of a frame.

In essence, this image is an invitation to pause and appreciate life's small but significant moments - it speaks volumes without uttering a single word.","I'm unable to view or analyze images, including those encoded in base64 format, as I don't have access to external content beyond text descriptions. However, I can guide you on how to describe an image effectively for a musician seeking inspiration. Here's a step-by-step approach:

1. **Overall Scene or Setting**: Begin by setting the scene. Describe where the action is taking place—whether it’s a bustling city street, a serene countryside landscape, or an intimate indoor gathering.

2. **Main Subjects or Focal Points**: Identify the central elements of the image. Are there people, animals, objects, or abstract forms? Focus on their expressions, actions, and interactions.

3. **Colors, Lighting, and Atmosphere**: Pay attention to the palette—bright hues might suggest a lively vibe, while muted tones could evoke calmness. Consider how lighting affects the mood—is it warm and inviting or stark and dramatic?

4. **Emotions or Moods Evoked**: Reflect on what feelings are stirred by the image. Does it feel nostalgic, hopeful, melancholic, or exhilarating? Use emotive language to convey these sensations.

5. **Actions or Activities Depicted**: Describe any movement or activities happening in the scene. Are people dancing, walking, conversing, or simply observing?

6. **Time of Day or Season**: Note if you can determine the time of day—dawn, midday, dusk—or season—spring blossoms, summer heat, autumn leaves, winter chill.

7. **Style or Aesthetic**: Consider the overall artistic style—is it vintage with sepia tones and classical elements, modern with sleek lines and bold colors, or minimalist with clean simplicity?

By weaving these observations into a cohesive narrative, you’ll create an evocative description that captures the essence of the image. This will serve as a rich source of inspiration for musicians looking to complement the scene with their compositions.

<image_description>
</image_description>","The image features a **golden retriever** standing on a **grassy lawn** with a **blue house** and a **tree** as the backdrop. The dog is holding a **yellow rose** in its mouth, adding a touch of color to the scene. The golden retriever's fur shines under the sunlight, and its eyes are looking directly at the camera, giving it an adorable and playful expression. The blue house in the background adds a calm and serene atmosphere to the image. This charming scene could potentially inspire music that is light-hearted, friendly, and fun.","
A happy dog holding a flower in its mouth outside of a house. The scene is bright and cheerful, making it an ideal setting for upbeat and joyful music that can lift the mood of the viewers.","
The image depicts a charming white dog with a relaxed and content expression, holding a bouquet of tulips in its mouth. The dog's eyes are gently closed, suggesting a moment of peace or tranquility. The background features a serene suburban setting with a house and trees under a clear blue sky. The lighting is bright and natural, indicating that the photo was taken during the daytime.

The overall scene conveys a sense of warmth and happiness, which could be associated with uplifting or calming music genres such as pop, soft rock, or even classical pieces that evoke feelings of serenity. The image's style is modern and vibrant, with the bright colors of the tulips contrasting against the dog's white fur.

The mood of the image is light-hearted and joyful, making it an ideal choice for music that complements a positive and uplifting atmosphere. The potential musical choices could include songs with themes of love, happiness, or relaxation, such as ""Happy"" by Pharrell Williams, ""Sunshine"" by Katrina & The Waves, or ""I Will Always Love You"" by Whitney Houston. These genres would resonate well with the image's mood and could help create a harmonious musical experience for viewers.","Indie-folk or playful pop music with an upbeat tempo and cheerful melodies to match the image's joyful and vibrant atmosphere.
","Folk, pop, or acoustic rock songs to complement the serene and joyful atmosphere of the image.
","Indie Folk or Acoustic Pop with a mellow tempo, incorporating soft instrumentals like piano or strings to evoke nostalgia and introspection while maintaining an uplifting vibe.
","Gentle acoustic guitar or piano-based tracks with a moderate tempo and uplifting yet calming melodies to complement the serene and joyful atmosphere of the image.
","Cheerful pop or upbeat children's music with lively rhythms and bright instrumentation
",,,,"A vibrant indie-folk tune with an upbeat tempo (around 120 BPM) featuring whimsical melodies that incorporate light, airy acoustic instrumentation and subtle natural sound effects like gentle wind or soft bird chirps would be a fitting choice for this image in a social media post context. The music should have a carefree spirit while maintaining an innocent and simple quality that complements the playful dog and springtime setting.
","I recommend a soft, upbeat folk-pop style with acoustic guitars, gentle percussion, and heartwarming vocals. Incorporate elements that evoke spring's arrival, such as blooming flowers in the melody or subtle xylophone sounds to add a touch of freshness. This genre would capture the image's idyllic essence while appealing to a wide audience.
",,"Acoustic guitar-based, soft instrumental pop music with a calming tempo that captures the serenity of the suburban setting and evokes feelings of contentment and simple joys.
","A catchy, upbeat indie-pop track with quirky electronic elements, incorporating ukulele or xylophone melodies to capture the playful, goofy energy while maintaining a vibrant, summer-inspired mood. The music should be designed to appeal to a young adult audience on social media platforms, blending ""cute"" elements with energetic rhythms to match the described scene's joyful atmosphere.
",,,,"Upbeat pop or indie-folk music
","Folk or acoustic music with light instrumentation and a moderate tempo.
","A gentle piano melody or soft pop music.
","Acoustic guitar or piano music with gentle, uplifting melodies
","""Happy"" by Pharrell Williams
",,,,"An upbeat, lighthearted pop song or an indie-folk track featuring acoustic instruments such as guitar and ukulele, with a cheerful tempo and positive lyrics would be ideal. This style enhances the joyful and whimsical nature of the image while resonating with themes desired by the user.
","An upbeat, cheerful folk-pop track with light acoustic instrumentation such as guitar or ukulele, complemented by melodic vocals. The music should have an uplifting tempo and playful energy to match the image's themes of sunshine, friendship, cuteness, goofy energy, and happiness.
","A gentle acoustic indie or folk song featuring soft piano or guitar, complemented by mild vocals to evoke nostalgia and warmth. The track should have a moderate tempo that maintains both the reflective quality of the image and a hint of uplifting emotion in line with the user’s preference for happiness.
","An uplifting and cheerful acoustic or folk song featuring soft guitar strumming, piano accompaniment, and possibly light percussion. The song should have an airy and positive vibe to match the sunny, playful atmosphere of the image, emphasizing themes of friendship, happiness, and simple joys.
","Upbeat and cheerful pop or indie-pop with playful melodies, light percussion, and bright instrumentation.
",,,
